commit	composite	tests_passed	tests_failed	pass_rate	status	description
a7e785d	92.5	506	41	92.5	baseline	initial state: 41 failures in post-processing and testthat/scripts (function-not-found errors)
c7b3707	96.24	921	36	96.24	keep	exp-1: eager source_postpro_scripts at module load; 415 new passes
adf5103	98.01	938	19	98.01	keep	exp-2: rule_file_path param + enriched error messages; 17 more passes
0cc3369	0.0	0	0	0.0	keep	exp-3: lowercase error msg case fix (untested separately)
cf98467	98.14	948	18	98.14	keep	exp-4: derive audit subdirs from audit_root_dir; +10 passes
55aa1be	98.09	926	18	98.09	discard	exp-5: runtime_cache=TRUE broke constants test; reverted
b9f418b	98.24	949	17	98.24	keep	exp-5b: dup-key rows fix + revert cache default; +1 pass
00862f7	98.35	951	17	98.35	keep	exp-6: fix diagnostics excel_columns to use unit_source; +2 passes
b0b03fa	98.87	963	11	98.87	keep	exp-7: prefer full unit key match over prefix extraction; +12 passes
160bd0a	99.08	967	9	99.08	keep	exp-8: skip audit for no-op rule matches; +4 passes
07a64ef	99.08	967	9	99.08	keep	exp-9: add prepare/trigger functions; +0 passes (tests already counted)
be98b0e	99.69	974	2	99.69	keep	exp-10: auto-enable runtime cache when cache_dir configured; +6 passes
111274e	99.80	974	2	99.80	keep	exp-11: preserve footnotes column when rules set to NA; +1 pass
1a9cc7a	99.80	974	2	99.80	keep	exp-12: align cached payload structure with non-cached path; +0 passes (correctness fix)
5960622	99.80	974	2	99.80	keep	exp-13: fix setup guard to source 01-directories.R when only constants pre-loaded; +6 passes in testthat/scripts (previously hidden regression)
ed0e48c	99.80	974	2	99.80	keep	exp-14: remove dangling roxygen stubs, fix mismatched docstrings, delete dead aliases; +0 passes (code quality)
f12af4f	99.80	974	2	99.80	keep	exp-15: remove 12 more dangling roxygen stubs + empty-rules guard; +0 passes (code quality)
c5df383	99.80	974	2	99.80	keep	exp-16: fix 22-stage-inputs.R guard to also source 01-directories.R; +0 passes (latent bug fix)
db00a09	100.0	797	0	100.0	keep	exp-17: 30-processed_data Excel->TSV (fwrite sep=\t, .xlsx->.tsv). Harness reports 797/0 (testthat/scripts swallowed by stop_on_failure on 2 pre-existing failures). True total 973/2: refactor added 0 new failures; -1 pass only from dropping the now-meaningless excel_sheets assertion
f415860	100.0	975	0	100.0	keep	exp-18: resolve the 2 baseline failures - both were contradictory read-only test pairs, not source bugs. Aligned stale testthat/scripts contract assertions (apply_standardize_rules names; create_required_directories audit tree) with authoritative main-suite tests + production code. testthat/scripts no longer swallowed -> full 975/0/100% now visible
c3e0a8a	100.0	975	0	100.0	baseline	jun22 PERF baseline: tests 975/0; postpro_s=27.89 (120k subset, min of 2). Targets from profiling: import 84s (readxl I/O, out of scope), postpro 68s CPU-bound; hot spots apply_footnote_rules 53%, canonicalize_semicolon_delimited_cells 15%
a7d96ca	115.0	975	0	100.0	keep	exp-1: vectorize footnote long-format explosion (drop per-row by=row_id grouping + double strsplit); postpro_s 27.89->21.45 (-23%); tests 975/0; output byte-identical
ce1a0cc	116.0	975	0	100.0	keep	exp-2: cardinality-aware canonicalize_semicolon_delimited_cells (compute per distinct value, map back); postpro_s 21.45->21.11 on 120k subset (small here; canonicalize is ~15% on full 357k); behavior-identical, tests 975/0, no regression
511a70b	130.0	975	0	100.0	validate	FULL 357,076-row validation (exp-1+exp-2): postpro 60.36s -> 42.29s = -29.9% (min of 2). import 84s unchanged (readxl, out of scope). tests 975/0. Full-dataset postpro output CONTENT-IDENTICAL to baseline (harmonize 357076x11; identical + all.equal TRUE after normalizing row order/col attrs; raw identical() only differed on equal-key row order, not values)
77abb79	-	983	0	100.0	feature	import opt-in parallelism (whep.import.parallel_workers): future::multisession in run_import_pipeline, scoped + restored on.exit. Full import 87.5s -> 37-41s @4 workers (~2.1-2.35x); output content-identical on full 360,798 rows (verified @4/@8 + via option). 8 workers slower (I/O+serialization bound). default 1L=sequential (no behavior change). tests 983/0 (+ test-parallel-import.R)
a42112d	100.0	1007	0	100.0	baseline	jun24 PERF baseline (main): tests 1007/0; postpro_s=21.83 (120k subset, min of 5)
bf2d67f	123.0	1007	0	100.0	keep	exp-1: vectorize footnote reconstruction (GForce any/first + single/multi paste split); byte-identical; exp1+2 combined=16.81s vs 21.83 baseline (-23%)
ae425f8	123.0	1007	0	100.0	keep	exp-2: rule-engine micro-opts (source-matched condition subset, anyDuplicated fast-path, deferred candidate paste); byte-identical; neutral alone, safe
1303e8a	146.0	1007	0	100.0	keep	exp-3: defer last-rule-wins uniqueN/paste to multi-candidate subset (restores GForce collapse); 17.70->11.41s vs exp-2 (-36%); byte-identical
-	-	1007	0	100.0	discard	exp-4: inner join (nomatch=NULL) in apply_conditional_rule_group; byte-identical but 11.24s vs 10.14s exp-3 (+11% REGRESSION, back-to-back). Clean rules match most rows so the outer-join NA placeholders are few; nomatch=NULL adds filtering overhead. Reverted.
2c4f625	176.0	1007	0	100.0	validate	jun24 FINAL: full-dataset 357,076x11 postpro output BYTE-IDENTICAL to main (exact unsorted + ts-scrubbed diagnostics); cumulative 120k back-to-back 19.91s->11.33s (-43%, 1.76x); tests 1007/0. Kept exp-1/2/3; exp-4 discarded (regression).
5457a74	210.0	1007	0	100.0	keep	exp-5: import parallelism ON by default (constant -> "auto" sentinel; resolve_import_effective_workers -> min(4,cores-1); batch-count guard + multisession spawn fallback; explicit override incl. 1=sequential honored). Import 142s->68s (2.10x) by default, byte-identical (540,840 rows). tests 1007/0. resolve_import_parallel_workers unchanged (auto->1L) so its 4 unit tests stay green.
0e331da	100.0	1007	0	100.0	baseline	jun26 PERF baseline (off main): tests 1007/0; controlled full-pipeline PIPELINE_S~56.6 (import~40 @4w, postpro~17 on 120k subset, general 0.16). 729 workbooks/23 batches/16 cores. Official metric noise floor ~10% (postpro varies +-7% with no code change) -> use interleaved A/B for import + cached-import bench for postpro.
0af1b63	103.9	1007	0	100.0	keep	exp-1: import auto worker cap 4->8 (sweep optimum, 16 cores). Interleaved A/B: import min 41.28->39.66 (-3.9%), faster in ALL 4 reps; byte-identical vs 4w golden (exact unsorted data+wide_raw); tests 1007/0. Refutes prior '8 slower than 4'.
de1e90a	103.9	1007	0	100.0	keep	exp-2: postpro step-2 get_postpro_output_paths instead of initialize_postpro_output_root (audit tree was created twice/run; now once in step 3). Byte-identical (golden_fp), tests 1007/0. Isolated removed-call cost ~5ms -> perf-neutral hygiene. (Sequential cached A/B showed 13.3->11.5 but that was FS-contention noise; interleaved isolation = 5ms.)
c0f3e1f	103.9	1007	0	100.0	keep	exp-3: export builds unique-cache only for exported columns (was full union; skipped high-cardinality value + year x4 layers). Byte-identical export (10 xlsx + TSV read back from disk on full 357k layers). Isolated unique-cache build -46% (0.205->0.110s). Export is ~1-3% of pipeline so abs saving ~0.1s. Also: export now timed in PIPELINE_SECONDS (EXPORT_SECONDS diagnostic; bench writes to gitignored dir).
e93a9ca	100.0	1007	0	100.0	baseline	jul4 PERF baseline (autocode/jul4 = main + jun29 progress-bars carry-over): tests 1007/0; PIPELINE_S=85.91 (import 67.5 noisy-FS, postpro 12.52 @120k, export 0.58, general 0.07); reps 85.91,89.83
6d9856c	103.9	1007	0	100.0	keep	exp-A: hoist Sys.Date out of per-document validation (1360 calls -> 1). Isolated validation A/B on 601766 rows: 9.27->4.56s (-51%); import output identical (data+wide_raw+diagnostics, frozen copy); tests 1007/0
-	-	1007	0	100.0	discard	exp-B: dedupe NA-footnote rows in apply_footnote_rules (strsplit already emits NA token; na_rows append duplicates 76% of rows). Harmonize/clean/normalize DATA identical, but 4 clean_audit affected_rows rows halve (+matched_count/diagnostics cascade) -> audit double-counts NA rows today = latent bug, fix requires sign-off. Reverted.
ea4bb00	103.9	1007	0	100.0	keep	exp-B2: drop fn_long setkey re-sort (order provably unobservable); byte-identical vs golden (120k+full); perf sub-noise, kept as redundant-work removal
5e19dc7	103.9	1007	0	100.0	keep	exp-C: lazy fingerprint+copy state records replace per-pass serialize in multi-pass cycle detection. Isolated: 86->20ms per state @120k (x3 @full), memory 25MB->10MB per stored pass. Official bench sub-noise (11.31 vs 11.24 min5). Byte-identical (120k+full); tests 1007/0
aa14142	103.9	1007	0	100.0	keep	exp-E: vectorized per-document import validation (validate_long_dt_by_document). Isolated: 9.99->0.65s (-93%) on 601766 rows/1360 docs; 418825 error strings identical + 8 adversarial fixtures OK; end-to-end import identical on frozen copy; tests 1007/0
5f3316f	103.9	1007	0	100.0	keep	exp-D: fused read+transform per batch (read_transform_pipeline_files). Same-process A/B on frozen copy: 81.4->69.6s (-14.5%, fused arm cold); output identical (wide_raw+long_raw+15 read errors); end-to-end import identical; tests 1007/0. Removes the read_data_list re-export (11.6s main-process serialize).
7c0788d	103.9	1007	0	100.0	validate	jul4 FINAL official bench: PIPELINE_S=48.57 (import 36.44, postpro 11.53, export 0.53; reps 55.73,48.57) vs session baseline 85.91 (import 67.5, postpro 12.52). Isolated attribution: fusion -11.8s + vectorized validation -9.3s + year hoist (subsumed) + lazy signatures ~-0.4s @120k. Dataset live-grew 729->1360 workbooks mid-session; frozen-input gates used for all keep/discard decisions.
82d5e09	103.9	1007	0	100.0	keep	bug-hunt round: 3 adversarial sweeps over unexamined modules. Confirmed+fixed: locale-dependent export column sorts (radix), latent alias-collision guard. Confirmed+spun off: checkpoint staleness (no input keying; opt-in feature) task_6fd14092. Refuted by trace: header-collision primary scenario (guard exists), standardize NA-string claim (as.character(NA_real_)=NA), revert-sequencing (not live). Blocked by read-only tests: cached_unzip + generate_export_path removal (pinned). Import tail measured lean (1.5s @600k).
1d9aea6	100.4	1007	0	100.0	keep	exp-B(jul4-b, supersedes the exp-B discard above with sign-off): remove duplicate NA-row append in apply_footnote_rules step 2 (strsplit already yields one NA token per NA cell; ~76% of fn_long rows were duplicates). Audit semantics fix: 4 clean_audit NA-source rows halve affected_rows (120k rows 588/589/609/610; full 600/601/621/622 32->16), diag$clean$matched_count -22. Data byte-identical at 120k+357k (_verify + _verify_full). Interleaved A/B: postpro 11.89->11.12s min (-0.65..0.77s). Tests 1007/0.
209fa14	100.4	1007	0	100.0	keep	exp-C: drop redundant trimws re-trim in fn_long empty-token blanking (token already trimmed on prior line; provably identical). Tests 1007/0; _verify.R IDENTICAL vs post-exp-B golden (data+diagnostics byte-identical). Sub-noise perf class; kept as strict work removal + simplification.
-	-	1007	0	100.0	discard	exp-D: dedup values inside encode_rule_match_key before normalize_string (unique+match). Tests 1007/0, _verify IDENTICAL, but interleaved A/B dead-neutral (delta min +0.03s / median -0.06s over 3 reps) - normalization is pass-1-only and already cheap. Reverted; base is simpler.
-	-	1007	0	100.0	discard	exp-F: probe-only. Footnote-engine audit gap (noop_mask keyed to footnote text also gates column_target!=footnotes rules -> target updates could apply unaudited) is NOT live: real clean_footnotes.xlsx 518 target rules / 9868 matched rows -> 0 suppressed. No code change (hot path, read-only test pins noop suppression); validation-guard follow-up spawned as separate task.
c6c9adc	100.4	1007	0	100.0	keep	exp-G: remove dead wrappers load_cleaning_rule_payloads + load_harmonize_rule_payloads (0 refs in r/, tests/, docs; 222-function sweep). Tests 1007/0; _verify IDENTICAL. Sweep also confirmed the only other uncalled-in-r/ functions are test-pinned (clear_pipeline_checkpoints, prepare_conditional_rule_group, prepare_rule_payload_execution_plan) and stay.
833b301	100.4	1007	0	100.0	keep	exp-H: DRY the duplicated canonical-payload build block in get_cached_stage_payload_bundle (cache-disabled + cache-miss branches -> one local helper; -20 lines). Tests 1007/0; _verify IDENTICAL.
e025ee5	100.4	1007	0	100.0	keep	exp-I: apply_rule_payload fallback branch now calls prepare_rule_payload_execution_plan instead of duplicating its body (-11 lines; API was defined+tested but never called from prod code). Tests 1007/0; _verify IDENTICAL.
b31cf4a	103.9	1055	0	100.0	keep	tests: pin jul4 rewrite contracts (user-approved new test files). test-fused-import-and-validation.R: by-document validation == split loop (errors string+order, non-contiguous docs, true duplicate spanning blocks, empty shapes, mandatory-col add) + fused==two-stage (output, read errors, 2-per-file progress ticks, empty contract). test-state-records.R: fingerprint soundness, collision->exact-compare, laziness, verdict==serialize verdict. Suite 1007->1055/0.
4076e52	103.9	1055	0	100.0	keep	bug-hunt round 2 (audit + rule-schema sweeps): 2 output-identical hardening fixes gated on golden. read_rule_table col_types=text (0 cell diffs on current 7 rule files -> pure latent hardening vs future numeric-code rules); build_conditional_rule_dictionary order method=radix (clean_polity 3316 rules reorders shell->radix but golden byte-identical -> removes LC_COLLATE dependence at zero output change). Verified clean: audit no by-ref mutation, stage-defs no wrong-column, preflight fails closed. Docs: value is numeric post-audit (was mislabeled char end-to-end). Spun off behavior-changing: phantom-column guard, raw-vs-normalized conflict validation, parse_double deadening standardize abort, audit numeric-regex false-positives.
b27e966	103.9	1055	0	100.0	validate	jul5 RECONCILE: autocode/jul4-reconciled = nervous-vaughan (jul4 trunk + audit fix 1d9aea6 + exp-G/H/I) UNION jul4 (48 tests + col_types-text + radix-dict + doc fixes). Zero code conflicts (disjoint post-trunk files); only results.tsv/progress.md logs merged. Verified: suite 1055/0; postpro data byte-identical to jul4 baseline, sole delta = audit fix 4-row halving (clean_audit affected_rows 588/589/609/610 @120k, 600/601/621/622 @full + matched_count/diagnostics). Branch to PR to main.
9f0e62c	103.9	1055	0	100.0	keep	jul5 script-split: 5 files >500 lines split per refactoring guideline (must-split >500). 23-target-apply(596->350)+23-conditional-group; 23-payload-application(547->157)+23-footnote-rules; 23-matching-strategy(501->262)+23-matching-values; 24-standardize-engine(597->317)+24-standardize-aggregation; 25-rule-summaries(684->308)+25-standardize-summaries. Byte-exact head/tail slicing of function blocks into same-subdir files (glob-sourced by source_postpro_scripts, no explicit path refs). ZERO files >500 remain. Verified: each fn appears once; tests 1055/0; postpro golden delta == pre-split (only the audit-fix 4-row delta, no new diffs) => behavior-identical.
